{
  "$schema": "http://json-schema.org/draft-07/schema#",
  "$id": "https://ghost-spec.dev/schema/v1/corpus-manifest.schema.json",
  "title": "GHOST corpus manifest",
  "description": "Draft schema interpreting GHOST v1.0 section 4.1.1 and section 2 (corpus manifest): the signed declaration of the corpus, each source's identity, provenance, license basis, and content hash where the material is held locally. The corpus is enumerated, not implied.",
  "type": "object",
  "additionalProperties": false,
  "required": ["ghostVersion", "subject", "sources"],
  "properties": {
    "ghostVersion": { "const": "1.0" },
    "subject": { "type": "string" },
    "closingDate": { "type": "string", "format": "date", "description": "For a projection's corpus: the date after which the subject will say nothing further (9.2)." },
    "sources": {
      "type": "array",
      "minItems": 1,
      "items": {
        "type": "object",
        "additionalProperties": false,
        "required": ["id", "title", "type", "provenance", "licenseBasis", "held"],
        "properties": {
          "id": { "type": "string" },
          "title": { "type": "string" },
          "type": { "enum": ["book", "video", "audio", "article", "site", "course", "interview", "other"] },
          "provenance": { "enum": ["official", "independent", "user-generated", "archival"] },
          "licenseBasis": { "type": "string", "description": "The declared basis: purchased copy, public captions, public domain, licensed private material, study copy with no basis of its own. Honesty over neatness." },
          "held": { "type": "boolean", "description": "Whether the material is held locally. If true, hash is required." },
          "hash": { "type": "string", "pattern": "^[a-f0-9]{64}$", "description": "SHA-256 of the held material (4.1.1)." },
          "location": { "type": "string" },
          "url": { "type": "string" }
        },
        "if": { "properties": { "held": { "const": true } } },
        "then": { "required": ["hash"] }
      }
    },
    "exclusions": {
      "type": "array",
      "items": { "type": "object", "additionalProperties": false, "required": ["what", "reason"], "properties": { "what": { "type": "string" }, "reason": { "type": "string" } } },
      "description": "What is deliberately out of corpus, recorded so the exclusion cannot be silent."
    },
    "signature": { "type": "object", "description": "Signing is the operator's act; for official class the profile is signed by the subject's own key (8.1). Shape deferred to the SAGA signature format.", "additionalProperties": true }
  }
}
